{
  "artifacts": [
    {
      "architecture": "x86_64",
      "bytes": 49019056,
      "path": "marginbench/bin/margin-linux-x86_64",
      "platform": "linux/amd64",
      "sha256": "4cb70cbe57faf31b0187da95330d176f246fd62624c2a13f73b08cbca5cf0de9"
    },
    {
      "architecture": "aarch64",
      "bytes": 47970400,
      "path": "marginbench/bin/margin-linux-aarch64",
      "platform": "linux/arm64",
      "sha256": "4626d6fef901b67bfa95d4f215c0f7cf777587e33349fcf24c7acb2f8f6a8ce7"
    }
  ],
  "build": {
    "containerImage": "swift:5.10-jammy@sha256:ffc42e399ad0cad324f68d58f65e4d5f2c22eb9df73c4dfa249e898d497254b3",
    "dockerfileSha256": "794129def4f1b1138c0dc864951ef89f7c3ce7d8d394f5e17883afc1e8610208",
    "packageManifestSha256": "542f201e1cec691d06f1b2c5725d8dfb0d9638558e8daa3daeae1020fc53d749",
    "scriptSha256": "66e117d0b0782b43342d3b2e4e936336d1230b24ea09e9fbde6a569abacda0e6",
    "sourceTreeSha256": "2a2e9da095772217419beced891f06f9b59ea89797250ee1074003258f0b5fde",
    "staticSwiftStandardLibrary": true
  },
  "marginVersion": "0.5.1",
  "schema": "urn:marginbench:binary-manifest:v1",
  "verification": {
    "referenceEpisodesPerArtifact": 9,
    "safetyPassed": true,
    "score": 100
  }
}
